{
  "asset_id": "MARIUPOL_WATER_WASTEWATER_2022_03_01",
  "name": {
    "en": "Mariupol Water Supply and Wastewater Treatment System",
    "uk": "Система водопостачання та водовідведення Маріуполя"
  },
  "location": {
    "lat": 47.0958,
    "lon": 37.5421,
    "oblast": "Donetsk",
    "raion": null,
    "settlement": "Mariupol",
    "address_en": "Mariupol city water infrastructure, Donetsk Oblast"
  },
  "asset_type": "water.supply",
  "sector": "water_and_sanitation",
  "damage": {
    "incident_date": "2022-03-01",
    "incident_type": "artillery_shelling",
    "destruction_level": "destroyed",
    "re_damage_count": 0,
    "verified_by": [
      "KSE",
      "UN_OCHA",
      "BELLINGCAT"
    ],
    "evidence_sources": [
      {
        "title": "KSE Russia Will Pay — Mariupol infrastructure",
        "source_code": "KSE"
      },
      {
        "title": "UN OCHA Ukraine Situation Reports — Mariupol siege",
        "source_code": "OCHA"
      }
    ]
  },
  "wartime_status": {
    "lifecycle": "in_pipeline",
    "rebuildability": "occupied",
    "de_risking": [
      "NONE"
    ],
    "sovereign_risk_band": "severe"
  },
  "physical_specs": {
    "service_population": {
      "value": 430000,
      "unit": "people",
      "source": "extracted_from_source",
      "ref": "Pre-war population, KSE"
    },
    "treatment_capacity_m3_per_day": {
      "value": null,
      "unit": "m³/day",
      "source": "pending_data",
      "ref": "To be confirmed post-liberation"
    }
  },
  "cost_paths": {
    "baseline": {
      "low_usd_m": 470,
      "central_usd_m": 1102,
      "high_usd_m": 1735
    },
    "code_compliant": {
      "low_usd_m": 540,
      "central_usd_m": 1355,
      "high_usd_m": 2169
    },
    "build_back_better": {
      "low_usd_m": 611,
      "central_usd_m": 1694,
      "high_usd_m": 2776
    }
  },
  "financing_structures": {
    "baseline": {
      "grant_pct": 45,
      "concessional_pct": 40,
      "public_equity_pct": 15,
      "private_pct": 0,
      "comparable_projects": []
    },
    "code_compliant": {
      "grant_pct": 50,
      "concessional_pct": 35,
      "public_equity_pct": 15,
      "private_pct": 0,
      "comparable_projects": []
    },
    "build_back_better": {
      "grant_pct": 55,
      "concessional_pct": 30,
      "public_equity_pct": 15,
      "private_pct": 0,
      "rationale": "EU Facility water sector track; smart metering and leak detection qualify for green conditionality; EBRD RSF applicable",
      "comparable_projects": []
    }
  },
  "donor_pathway": {
    "united24_url": null,
    "mriya_url": null,
    "vetted_ngos": []
  },
  "tags": [
    "water",
    "donetsk",
    "mariupol",
    "artillery_strike",
    "occupied"
  ],
  "last_reviewed": "2026-05-14",
  "version": "1.0.0"
}
